{
  "$schema": "https://ngwr.dev/registry/schema.json",
  "name": "block-sign-in",
  "type": "registry:block",
  "title": "Sign-in card",
  "description": "A centred sign-in card built from wr-card, wr-form-field, wr-input and wr-btn, wired to Signal Forms with the library's own validators.",
  "author": "ngwr",
  "ngwr": ">=11",
  "entryPoints": [
    "ngwr/card",
    "ngwr/form",
    "ngwr/input",
    "ngwr/button"
  ],
  "files": [
    {
      "path": "sign-in.ts",
      "target": "src/app/sign-in/sign-in.ts",
      "content": "import { Component, signal } from '@angular/core';\nimport { FormField, email, form, required } from '@angular/forms/signals';\n\nimport { WrButton } from 'ngwr/button';\nimport { WrCard } from 'ngwr/card';\nimport { WrFormField } from 'ngwr/form';\nimport { WrInput } from 'ngwr/input';\n\n@Component({\n  selector: 'app-sign-in',\n  templateUrl: './sign-in.html',\n  // `FormField` is what makes `[formField]` a binding rather than an unknown\n  // attribute \u2014 it is Angular's directive, not one of ngwr's, and leaving it\n  // out is the mistake this block shipped with.\n  imports: [FormField, WrCard, WrFormField, WrInput, WrButton],\n})\nexport class SignIn {\n  protected readonly model = signal({ email: '', password: '' });\n\n  // The rules come from `@angular/forms/signals`. `WrValidators` is the other\n  // half of the story and does not fit here: those are `ValidatorFn`s for a\n  // reactive `FormControl`, and its set is the ones Angular has no equivalent\n  // for \u2014 `cardNumber`, `iban`, `matchFields`. There is no `WrValidators.required`.\n  protected readonly f = form(this.model, path => {\n    required(path.email);\n    email(path.email);\n    required(path.password);\n  });\n\n  protected submit(): void {\n    if (this.f().invalid()) return;\n    // POST this.model() somewhere.\n  }\n}\n"
    },
    {
      "path": "sign-in.html",
      "target": "src/app/sign-in/sign-in.html",
      "content": "<wr-card class=\"app-sign-in\">\n  <h1>Sign in</h1>\n\n  <wr-form-field label=\"Email\">\n    <input wrInput type=\"email\" autocomplete=\"email\" [formField]=\"f.email\" />\n  </wr-form-field>\n\n  <wr-form-field label=\"Password\">\n    <input wrInput type=\"password\" autocomplete=\"current-password\" [formField]=\"f.password\" />\n  </wr-form-field>\n\n  <button wr-btn color=\"primary\" type=\"button\" [disabled]=\"f().invalid()\" (click)=\"submit()\">Sign in</button>\n</wr-card>\n"
    },
    {
      "path": "sign-in.scss",
      "target": "src/app/sign-in/sign-in.scss",
      "content": ".app-sign-in {\n  display: grid;\n  gap: 1rem;\n  max-inline-size: 22rem;\n  margin-inline: auto;\n}\n"
    }
  ]
}
